{
  "schema_version": "0.1",
  "evaluation_id": "eval-1",
  "request_id": "req-1",
  "tenant_id": "t-acme",
  "project_id": "p-demo",
  "application_id": "a-rag",
  "interaction_id": "int-1",
  "created_at": "2026-09-13T00:00:00Z",
  "status": "COMPLETED",
  "verdict": "PARTIAL",
  "claims": [
    {
      "claim_id": "c1",
      "text": "Acme was founded in 2018",
      "text_status": "AVAILABLE",
      "verdict": "SUPPORTED",
      "evidence_ids": ["doc-1"],
      "rationale_code": "DIRECT_SUPPORT",
      "contributing_judgments": [
        { "attempt_id": "attempt-1", "verdict": "SUPPORTED", "evidence_ids": ["doc-1"], "rationale_code": "DIRECT_SUPPORT" }
      ]
    },
    {
      "claim_id": "c2",
      "text": "Acme was founded by Jane Doe",
      "text_status": "AVAILABLE",
      "verdict": "UNSUPPORTED",
      "evidence_ids": [],
      "rationale_code": "NO_SUPPORT",
      "contributing_judgments": [
        { "attempt_id": "attempt-2", "verdict": "UNSUPPORTED", "evidence_ids": [], "rationale_code": "NO_SUPPORT" }
      ]
    }
  ],
  "scores": {
    "groundedness": { "value": 0.5, "status": "MEASURED", "method_version": "groundedness-0.1", "calibration_class": "class-1" }
  },
  "violations": [
    { "code": "UNSUPPORTED_CLAIM", "severity": "MEDIUM", "claim_ids": ["c2"], "evidence_ids": [] }
  ],
  "provenance": {
    "evaluator_id": "groundedness",
    "evaluator_version": "0.1",
    "policy_version": null,
    "mode": "STANDARD",
    "routing_profile_version": "standard-0.1",
    "started_at": "2026-09-13T00:00:00Z",
    "completed_at": "2026-09-13T00:00:00Z",
    "attempts": [
      {
        "attempt_id": "attempt-1",
        "provider_id": "example-judge",
        "model_id": "example-model",
        "pinned_model_version": "example-model-1",
        "configuration_version": "0.1",
        "qualification_status": "QUALIFIED",
        "calibration_class": "class-1",
        "outcome": "COMPLETED",
        "started_at": "2026-09-13T00:00:00Z",
        "completed_at": "2026-09-13T00:00:00Z",
        "usage": { "input_tokens": 96, "output_tokens": 20, "total_tokens": 116, "cost": { "status": "UNAVAILABLE" }, "latency_ms": 120 }
      },
      {
        "attempt_id": "attempt-2",
        "provider_id": "example-judge",
        "model_id": "example-model",
        "pinned_model_version": "example-model-1",
        "configuration_version": "0.1",
        "qualification_status": "QUALIFIED",
        "calibration_class": "class-1",
        "outcome": "COMPLETED",
        "started_at": "2026-09-13T00:00:00Z",
        "completed_at": "2026-09-13T00:00:00Z",
        "usage": { "input_tokens": 84, "output_tokens": 22, "total_tokens": 106, "cost": { "status": "UNAVAILABLE" }, "latency_ms": 118 }
      }
    ]
  },
  "usage_summary": { "input_tokens": 180, "output_tokens": 42, "total_tokens": 222, "cost": { "status": "UNAVAILABLE" } }
}
