{
  "schema_version": "0.1",
  "evaluation_id": "eval-0",
  "request_id": "req-0",
  "tenant_id": "t-acme",
  "project_id": "p-demo",
  "application_id": "a-rag",
  "created_at": "2026-09-13T00:00:00Z",
  "status": "COMPLETED",
  "verdict": "PASS",
  "claims": [
    {
      "claim_id": "c1",
      "text": "Product X weighs 2.4 kg",
      "text_status": "AVAILABLE",
      "verdict": "SUPPORTED",
      "evidence_ids": ["doc-1"],
      "rationale_code": "DIRECT_SUPPORT",
      "contributing_judgments": [
        { "attempt_id": "attempt-1", "verdict": "SUPPORTED", "evidence_ids": ["doc-1"], "rationale_code": "DIRECT_SUPPORT" }
      ]
    }
  ],
  "scores": {
    "groundedness": { "value": 1.0, "status": "MEASURED", "method_version": "groundedness-0.1", "calibration_class": "class-1" },
    "hallucination_risk": { "value": 0.0, "status": "MEASURED", "method_version": "hallucination-risk-0.1", "calibration_class": "class-1" },
    "contradiction_risk": { "value": 0.0, "status": "MEASURED", "method_version": "contradiction-risk-0.1", "calibration_class": "class-1" }
  },
  "violations": [],
  "policy_action": "PASS",
  "policy_version": null,
  "provenance": {
    "evaluator_id": "groundedness",
    "evaluator_version": "0.1",
    "policy_version": null,
    "mode": "STANDARD",
    "routing_profile_version": "standard-0.1",
    "started_at": "2026-09-13T00:00:00Z",
    "completed_at": "2026-09-13T00:00:00Z",
    "attempts": [
      {
        "attempt_id": "attempt-1",
        "provider_id": "example-judge",
        "model_id": "example-model",
        "pinned_model_version": "example-model-1",
        "configuration_version": "0.1",
        "qualification_status": "QUALIFIED",
        "calibration_class": "class-1",
        "outcome": "COMPLETED",
        "started_at": "2026-09-13T00:00:00Z",
        "completed_at": "2026-09-13T00:00:00Z",
        "usage": { "input_tokens": 88, "output_tokens": 16, "total_tokens": 104, "cost": { "status": "UNAVAILABLE" }, "latency_ms": 105 }
      }
    ]
  },
  "usage_summary": { "input_tokens": 88, "output_tokens": 16, "total_tokens": 104, "cost": { "status": "UNAVAILABLE" } }
}
